{
  "schema": "whatsoup.observation-envelope",
  "schema_version": "0.1",
  "envelope_id": "env-fixture-0002",
  "run_id": "run-fixture-0001",
  "subject": {
    "canonical_subject_id": "mini3/yl-bot",
    "binding": { "authority": "roster", "confidence": "exact" },
    "raw": { "host_label": "mini3", "instance_label": "yl-bot" }
  },
  "claim_id": "transport.http_liveness",
  "adapter_id": "public-liveness",
  "outcome": "pass",
  "projection": { "scope": "public", "authorization": "no_token" },
  "times": { "observed_at": "2026-08-20T22:01:00Z" },
  "authority": { "tier": "authenticated_diagnostic", "confidence": "confirmed" },
  "limitations": ["public envelope: HTTP liveness only — no identity, auth, version, or recovery information"]
}
